{
  "task_id": "T3.2.adam_adadas_param_extract.026",
  "category": "T3",
  "subcategory": "T3.2",
  "title": "Extract ADADAS (Parameter Definitions) variable metadata and derivation rules",
  "complexity": "complex",
  "license": "CC-BY-4.0",
  "provenance": {
    "seed_repo": "yanmingyu92/eSubmission-Benchmark",
    "seed_commit": "658fcc05506b169a27dee6e2c3a1ccdaaf64a716",
    "derivation_script": "scripts/build_T3.py",
    "human_authors": [
      "R01"
    ],
    "human_reviewers": [
      "R03"
    ]
  },
  "inputs": {
    "fixtures": [
      "fixtures/05_adam/ADaM_Specifications.md"
    ],
    "spec": "fixtures/05_adam/ADaM_Specifications.md#ADADAS",
    "prompt": "Extract the ADADAS (Parameter Definitions) analysis dataset metadata. This dataset contains 2718 records. Extract ADADAS PARAMCD/PARAM definitions. Focus on ACTOT total score and ACITM01-11 individual items, their scoring rules and ranges. Return as JSON with 'parameters' array."
  },
  "expected_outputs": {
    "kind": "json",
    "gold_path": "gold/T3.2.adam_adadas_param_extract.026/",
    "oracle": {
      "type": "slot_fill",
      "params": {
        "slots": [
          "parameters[].paramcd",
          "parameters[].description"
        ],
        "match_mode": "exact"
      }
    }
  },
  "scoring": {
    "scorer": "spec_extract",
    "weight": 1.0
  },
  "leakage_audit": {
    "fixture_sha256_overlap": false,
    "prompt_ngram_hits": 0
  },
  "difficulty_tag": "hard"
}
