{
  "task_id": "T4.3.val_protocol_sap_doc.006",
  "category": "T4",
  "subcategory": "T4.3",
  "title": "Document protocol-to-SAP alignment verification",
  "complexity": "complex",
  "license": "CC-BY-4.0",
  "provenance": {
    "seed_repo": "yanmingyu92/eSubmission-Benchmark",
    "seed_commit": "658fcc05506b169a27dee6e2c3a1ccdaaf64a716",
    "derivation_script": "scripts/build_T4.py",
    "human_authors": [
      "R02"
    ],
    "human_reviewers": [
      "R03"
    ]
  },
  "inputs": {
    "fixtures": [
      "fixtures/01_study_design/protocol/CDISCPilot01_Protocol.md",
      "fixtures/01_study_design/sap/CDISCPilot01_SAP.md"
    ],
    "spec": "fixtures/08_validation/document_alignment_checklist.md",
    "prompt": "Document the protocol-to-SAP alignment. Verify: objectives map to analyses, treatment groups consistent, populations defined consistently, endpoints specified consistently, and design elements aligned. Return structured documentation."
  },
  "expected_outputs": {
    "kind": "text",
    "gold_path": "gold/T4.3.val_protocol_sap_doc.006/",
    "oracle": {
      "type": "slot_fill",
      "params": {
        "slots": [
          "title",
          "validation_scope",
          "methodology",
          "check_categories",
          "findings_summary"
        ],
        "match_mode": "superset"
      }
    }
  },
  "scoring": {
    "scorer": "doc",
    "weight": 1.0
  },
  "leakage_audit": {
    "fixture_sha256_overlap": false,
    "prompt_ngram_hits": 0
  },
  "difficulty_tag": "hard"
}
