{
  "task_id": "T3.2.adam_adlbc_shift_extract.031",
  "category": "T3",
  "subcategory": "T3.2",
  "title": "Extract ADLBC (Shift Analysis Variables) variable metadata and derivation rules",
  "complexity": "mixed",
  "license": "CC-BY-4.0",
  "provenance": {
    "seed_repo": "yanmingyu92/eSubmission-Benchmark",
    "seed_commit": "658fcc05506b169a27dee6e2c3a1ccdaaf64a716",
    "derivation_script": "scripts/build_T3.py",
    "human_authors": [
      "R01"
    ],
    "human_reviewers": [
      "R03"
    ]
  },
  "inputs": {
    "fixtures": [
      "fixtures/05_adam/ADaM_Specifications.md"
    ],
    "spec": "fixtures/05_adam/ADaM_Specifications.md#ADLBC",
    "prompt": "Extract the ADLBC (Shift Analysis Variables) analysis dataset metadata. This dataset contains 7778 records. Extract ADLBC shift analysis variable derivation. Focus on SHIFT variable (baseline category to post-baseline category transition) and its relationship to ANRIND/BNRIND. Return as JSON with 'variables' array."
  },
  "expected_outputs": {
    "kind": "json",
    "gold_path": "gold/T3.2.adam_adlbc_shift_extract.031/",
    "oracle": {
      "type": "slot_fill",
      "params": {
        "slots": [
          "variables[].variable_name",
          "variables[].derivation_notes"
        ],
        "match_mode": "superset"
      }
    }
  },
  "scoring": {
    "scorer": "spec_extract",
    "weight": 1.0
  },
  "leakage_audit": {
    "fixture_sha256_overlap": false,
    "prompt_ngram_hits": 0
  },
  "difficulty_tag": "medium"
}
