{
  "task_id": "T1.3.tlf_cfb_gen.040",
  "category": "T1",
  "subcategory": "T1.3",
  "title": "Generate R program for 14-3.02 Change from Baseline Over Time",
  "complexity": "mixed",
  "license": "CC-BY-4.0",
  "provenance": {
    "seed_repo": "yanmingyu92/eSubmission-Benchmark",
    "seed_commit": "658fcc05506b169a27dee6e2c3a1ccdaaf64a716",
    "derivation_script": "scripts/build_T1.py",
    "human_authors": [
      "R01"
    ],
    "human_reviewers": [
      "R02"
    ]
  },
  "inputs": {
    "fixtures": [
      "fixtures/05_adam/ADaM_Specifications.md#ADADAS"
    ],
    "spec": "fixtures/06_tlfs/mock_templates/t_mock_14-3-02_cfb.md",
    "prompt": "Write an R program using rtables or Tplyr to generate 14-3.02: Change from Baseline Over Time. The program must: (1) Read ADADAS dataset, (2) Filter to Efficacy population, (3) Implement analysis: visit-wise change from baseline with standard errors, confidence intervals, and treatment comparisons, (4) Format table with treatment group columns (Placebo, Xanomeline Low, Xanomeline High), (5) Output as RTF document matching mock shell layout."
  },
  "expected_outputs": {
    "kind": "sas_program",
    "gold_path": "gold/T1.3.tlf_cfb_gen.040/",
    "oracle": {
      "type": "slot_fill",
      "params": {
        "slots": [
          "population_filter",
          "cfb_analysis_logic",
          "table_structure",
          "output_format"
        ],
        "match_mode": "superset"
      }
    }
  },
  "scoring": {
    "scorer": "codegen",
    "weight": 1.0
  },
  "leakage_audit": {
    "fixture_sha256_overlap": false,
    "prompt_ngram_hits": 0
  },
  "difficulty_tag": "medium"
}
