{
  "task_id": "T2.2.val_adam_bds.030",
  "category": "T2",
  "subcategory": "T2.2",
  "title": "Review ADaM BDS structure compliance for ADADAS and ADLBC",
  "complexity": "complex",
  "license": "CC-BY-4.0",
  "provenance": {
    "seed_repo": "yanmingyu92/eSubmission-Benchmark",
    "seed_commit": "658fcc05506b169a27dee6e2c3a1ccdaaf64a716",
    "derivation_script": "scripts/build_T2.py",
    "human_authors": [
      "R01"
    ],
    "human_reviewers": [
      "R02"
    ]
  },
  "inputs": {
    "fixtures": [
      "fixtures/05_adam/ADaM_Specifications.md",
      "fixtures/DATASET_CARD.md"
    ],
    "spec": "fixtures/08_validation/master_validation_plan.md",
    "prompt": "Verify ADADAS and ADLBC follow BDS structure with PARAM, PARAMCD, AVAL, BASE, CHG. Check variable completeness. Return JSON with 'findings' array. Return a structured JSON object with the reviewed findings."
  },
  "expected_outputs": {
    "kind": "json",
    "gold_path": "gold/T2.2.val_adam_bds.030/",
    "oracle": {
      "type": "slot_fill",
      "params": {
        "slots": [
          "findings[].*"
        ],
        "match_mode": "superset"
      }
    }
  },
  "scoring": {
    "scorer": "log_review",
    "weight": 1.0
  },
  "leakage_audit": {
    "fixture_sha256_overlap": false,
    "prompt_ngram_hits": 0
  },
  "difficulty_tag": "hard"
}
