{
  "task_id": "T1.1.sdtm_sv_gen.008",
  "category": "T1",
  "subcategory": "T1.1",
  "title": "Generate SAS program to create SDTM SV (Subject Visits) domain",
  "complexity": "mixed",
  "license": "CC-BY-4.0",
  "provenance": {
    "seed_repo": "yanmingyu92/eSubmission-Benchmark",
    "seed_commit": "658fcc05506b169a27dee6e2c3a1ccdaaf64a716",
    "derivation_script": "scripts/build_T1.py",
    "human_authors": [
      "R01"
    ],
    "human_reviewers": [
      "R02"
    ]
  },
  "inputs": {
    "fixtures": [
      "fixtures/04_sdtm/SDTM_Specifications.md",
      "fixtures/04_sdtm/programs/path.R"
    ],
    "spec": "fixtures/04_sdtm/SDTM_Specifications.md#SV",
    "prompt": "Write a SAS program to create the SDTM SV (Subject Visits) domain dataset. The program must: (1) Read raw subject visits data, (2) Derive USUBJID and SVSEQ (sequential numbering per subject), (3) Map key variables: VISITNUM, VISIT, SVSTDTC, SVENDTC, SVDY, (4) Handle visit derivation from subject elements, visit date handling, study day calculation, (5) Apply variable attributes per SDTM specification, (6) Create a permanent SAS dataset with xport format. The dataset contains approximately 3640 records."
  },
  "expected_outputs": {
    "kind": "sas_program",
    "gold_path": "gold/T1.1.sdtm_sv_gen.008/",
    "oracle": {
      "type": "slot_fill",
      "params": {
        "slots": [
          "required_variables[]",
          "sv_variable_mapping",
          "sv_derivation_logic",
          "output_format"
        ],
        "match_mode": "superset"
      }
    }
  },
  "scoring": {
    "scorer": "codegen",
    "weight": 1.0
  },
  "leakage_audit": {
    "fixture_sha256_overlap": false,
    "prompt_ngram_hits": 0
  },
  "difficulty_tag": "medium"
}
