{
  "task_id": "T3.1.sdtm_tv_extract.013",
  "category": "T3",
  "subcategory": "T3.1",
  "title": "Extract SDTM TV (Trial Visits) domain variable metadata",
  "complexity": "simple",
  "license": "CC-BY-4.0",
  "provenance": {
    "seed_repo": "yanmingyu92/eSubmission-Benchmark",
    "seed_commit": "658fcc05506b169a27dee6e2c3a1ccdaaf64a716",
    "derivation_script": "scripts/build_T3.py",
    "human_authors": [
      "R01"
    ],
    "human_reviewers": [
      "R03"
    ]
  },
  "inputs": {
    "fixtures": [
      "fixtures/04_sdtm/SDTM_Specifications.md"
    ],
    "spec": "fixtures/04_sdtm/SDTM_Specifications.md#TV",
    "prompt": "Extract the SDTM TV (Trial Visits) domain variable metadata. This domain contains 11 records. Extract TV domain variable metadata. Focus on visit numbering (VISITNUM, VISIT) and timing (VISTPT, VISTPTREF). Return as JSON with 'variables' array."
  },
  "expected_outputs": {
    "kind": "json",
    "gold_path": "gold/T3.1.sdtm_tv_extract.013/",
    "oracle": {
      "type": "slot_fill",
      "params": {
        "slots": [
          "variables[].variable_name",
          "variables[].type",
          "variables[].label"
        ],
        "match_mode": "exact"
      }
    }
  },
  "scoring": {
    "scorer": "spec_extract",
    "weight": 1.0
  },
  "leakage_audit": {
    "fixture_sha256_overlap": false,
    "prompt_ngram_hits": 0
  },
  "difficulty_tag": "easy"
}
