{
  "task_id": "T5.2.adam_adsl_v3_debug.009",
  "category": "T5",
  "subcategory": "T5.2",
  "title": "Debug ADSL derivation: Subject-Level (EOSSTT focus) errors",
  "complexity": "simple",
  "license": "CC-BY-4.0",
  "provenance": {
    "seed_repo": "yanmingyu92/eSubmission-Benchmark",
    "seed_commit": "658fcc05506b169a27dee6e2c3a1ccdaaf64a716",
    "derivation_script": "scripts/build_T5.py",
    "human_authors": [
      "R02"
    ],
    "human_reviewers": [
      "R01"
    ]
  },
  "inputs": {
    "fixtures": [
      "fixtures/05_adam/ADaM_Specifications.md#ADSL",
      "fixtures/04_sdtm/SDTM_Specifications.md"
    ],
    "spec": "fixtures/05_adam/ADaM_Specifications.md#ADSL",
    "prompt": "The following R program creates ADSL but has 2 bugs: (1) EOSSTT is set to 'Completed' for all subjects, (2) TRTDURD is missing +1 offset. Fix all bugs."
  },
  "expected_outputs": {
    "kind": "patch",
    "gold_path": "gold/T5.2.adam_adsl_v3_debug.009/",
    "oracle": {
      "type": "patch_apply",
      "params": {
        "bug_count": 2,
        "fix_locations": [
          "eosstt_derivation",
          "trtdurd_offset"
        ]
      }
    }
  },
  "scoring": {
    "scorer": "debug",
    "weight": 1.0
  },
  "leakage_audit": {
    "fixture_sha256_overlap": false,
    "prompt_ngram_hits": 0
  },
  "difficulty_tag": "easy"
}
