{
  "task_id": "T5.1.sdtm_ae_v2_debug.010",
  "category": "T5",
  "subcategory": "T5.1",
  "title": "Debug SDTM AE domain program: Adverse Events (outcome focus) errors",
  "complexity": "mixed",
  "license": "CC-BY-4.0",
  "provenance": {
    "seed_repo": "yanmingyu92/eSubmission-Benchmark",
    "seed_commit": "658fcc05506b169a27dee6e2c3a1ccdaaf64a716",
    "derivation_script": "scripts/build_T5.py",
    "human_authors": [
      "R02"
    ],
    "human_reviewers": [
      "R01"
    ]
  },
  "inputs": {
    "fixtures": [
      "fixtures/04_sdtm/programs/create_ae_v2.R",
      "fixtures/04_sdtm/SDTM_Specifications.md#AE"
    ],
    "spec": "fixtures/04_sdtm/SDTM_Specifications.md#AE",
    "prompt": "The following SAS program creates the SDTM AE domain but has 3 bugs: (1) AEOUT uses incorrect CDISC terms, (2) AESEQ resets for each visit within subject, (3) AEACN uses abbreviated codes. Fix all bugs."
  },
  "expected_outputs": {
    "kind": "patch",
    "gold_path": "gold/T5.1.sdtm_ae_v2_debug.010/",
    "oracle": {
      "type": "patch_apply",
      "params": {
        "bug_count": 3,
        "fix_locations": [
          "aeout_mapping",
          "aeseq_by_group",
          "aeacn_terminology"
        ]
      }
    }
  },
  "scoring": {
    "scorer": "debug",
    "weight": 1.0
  },
  "leakage_audit": {
    "fixture_sha256_overlap": false,
    "prompt_ngram_hits": 0
  },
  "difficulty_tag": "medium"
}
